{"schemaVersion":1,"slug":"scrapy","title":"Scrapy：Webページから構造化データを集める","summary":"Scrapyは、Webサイトを巡回し、必要な情報を構造化データとして取り出すためのPythonフレームワークです。","repository":"scrapy/scrapy","category":"automation","tags":["Python","Webスクレイピング","データ取得"],"publishedAt":"2026-09-05","verifiedAt":"2026-09-05","status":"published","sections":[{"heading":"何をするものか","paragraphs":["Scrapyは、Webページをたどりながら情報を取り出すためのPythonフレームワークです。取り出す項目と次に訪れるページを定義して、データ収集の処理を作れます。"]},{"heading":"役立つ点","paragraphs":["繰り返し確認したい公開情報を、同じ手順で集める仕組みにできます。集めたデータを表やファイルへ渡す前の、自動取得の流れを学ぶ入口になります。"]},{"heading":"始める前の注意","paragraphs":["自動取得が許可されているかはサイトごとに異なります。利用規約とrobots.txtを確認し、相手のサーバーへ負荷をかけない間隔と取得範囲を決めましょう。"]}],"sources":[{"label":"公式リポジトリ・README","url":"https://github.com/scrapy/scrapy"}]}
