{
  "schemaVersion": 1,
  "slug": "fzf",
  "title": "fzf：候補をあいまい検索して選ぶ",
  "summary": "fzfは、端末で候補の一覧から目的の項目を探して選ぶためのツールです。ファイル名、コマンド履歴、データの一覧などを入力にできます。入力した文字に近い候補を絞り込み、選んだ項目を次のコマンドへ渡せます。長い一覧からファイルや履歴を見つける作業を、端末のまま進めたいときに役立ちます。",
  "repository": "junegunn/fzf",
  "category": "developer-tools",
  "tags": ["CLI", "検索", "ターミナル"],
  "publishedAt": "2026-09-05",
  "verifiedAt": "2026-09-05",
  "status": "published",
  "sections": [
    {
      "heading": "候補から選ぶ道具",
      "paragraphs": [
        "fzfは、端末で動くあいまい検索の道具です。あいまい検索とは、候補の文字列に対して入力した文字が順に含まれるものを探す方法です。",
        "標準入力から候補の一覧を受け取り、選んだ項目を標準出力へ返します。標準入力と標準出力は、コマンド同士で文字列を渡す仕組みです。"
      ]
    },
    {
      "heading": "日常の操作を速くする",
      "paragraphs": [
        "ファイルを選ぶ、コマンド履歴を探す、一覧データを絞り込む、といった操作に使えます。",
        "Bash、Zsh、Fish、Nushell向けのキー操作と補完の連携も用意されています。補完は、入力途中の候補を表示して選べるようにする機能です。"
      ]
    },
    {
      "heading": "最初に設定を確認する",
      "paragraphs": [
        "キー操作や補完を使うには、利用するシェルの設定ファイルで連携を有効にします。シェルは、端末でコマンドを実行するプログラムです。",
        "候補の出し方はコマンドやオプションで変えられるため、まずは小さな一覧を渡して選ぶ操作から試すと分かりやすいでしょう。"
      ]
    }
  ],
  "sources": [
    {"label": "公式リポジトリ・README", "url": "https://github.com/junegunn/fzf"}
  ]
}
