{"schemaVersion":1,"slug":"latex2e","title":"LaTeX2e：構造を指定して文書を組版する","summary":"LaTeX2eは、技術文書、論文、数式を組版するための文書作成システムです。文章の構造を記述し、印刷向けの整った文書を作りたいときに役立ちます。","repository":"latex3/latex2e","category":"developer-tools","tags":["文書","組版","数式"],"publishedAt":"2026-09-05","verifiedAt":"2026-09-05","status":"published","sections":[{"heading":"文章の構造を書き表す","paragraphs":["LaTeX2eでは、見出し、段落、数式、参考文献などを命令で記述し、組版した文書を出力します。","内容の構造を先に書き、見た目を一貫して整える方法を学べます。"]},{"heading":"技術的な表現をそろえやすい","paragraphs":["数式、図表、引用、参照を文書の中で管理できます。","章や節が多い文書でも、番号付けや参照を手作業で直す量を減らせることが利点です。"]},{"heading":"コンパイル結果を確認する","paragraphs":["文書を出力するには、必要なパッケージや処理環境を用意します。","命令の書き方や参照の不足でエラーになることがあるため、短い文書をコンパイルするところから始めましょう。"]}],"sources":[{"label":"公式リポジトリ・README","url":"https://github.com/latex3/latex2e"}]}
