{"schemaVersion":1,"slug":"qdrant","title":"Qdrant：ベクトル検索を扱う","summary":"Qdrantは、AI向けのベクトル検索を行うベクトルデータベースです。","repository":"qdrant/qdrant","category":"data","tags":["ベクトル検索","AI"],"publishedAt":"2026-09-05","verifiedAt":"2026-09-05","status":"published","sections":[{"heading":"何をするものか","paragraphs":["Qdrantは、ベクトルを保存して近いものを探すベクトルデータベースと検索エンジンです。"]},{"heading":"役立つ点","paragraphs":["文章や画像を数値のベクトルに変換したあと、意味が近い候補を探す機能に使えます。"]},{"heading":"始める前の注意","paragraphs":["検索の質はベクトルを作るモデルとデータに左右されます。結果を人が確認できる画面も用意しましょう。"]}],"sources":[{"label":"公式リポジトリ・README","url":"https://github.com/qdrant/qdrant"}]}
