{"schemaVersion":1,"slug":"mattermost","title":"Mattermost：チームの会話と作業をまとめる","summary":"Mattermostは、チャット、通話、画面共有、ワークフローをチームで使うためのコラボレーション基盤です。","repository":"mattermost/mattermost","category":"developer-tools","tags":["チームチャット","コラボレーション","セルフホスト"],"publishedAt":"2026-09-05","verifiedAt":"2026-09-05","status":"published","sections":[{"heading":"何をするものか","paragraphs":["Mattermostは、チーム内の会話、通話、画面共有や作業の流れをまとめるためのコラボレーション基盤です。話題ごとのチャンネルを作り、必要な情報を共有できます。"]},{"heading":"役立つ点","paragraphs":["プロジェクトや障害対応などの会話を、目的ごとに分けて残せます。まずは小さなチームでチャンネルの使い分けと通知の設定を決めると、情報を追いやすくなります。"]},{"heading":"始める前の注意","paragraphs":["会話には社内情報や個人情報が含まれる場合があります。参加者の権限、外部連携、保存期間を確認し、自己運用では認証、バックアップ、更新を計画しましょう。"]}],"sources":[{"label":"公式リポジトリ・README","url":"https://github.com/mattermost/mattermost"}]}
