{
  "schemaVersion": 1,
  "slug": "ardupilot",
  "title": "ArduPilot：乗り物を自動制御するソフトウェア",
  "summary": "ArduPilotは、飛行機、マルチコプター、車両、船などの自動制御を扱うオープンソースのソフトウェアです。センサーを使って乗り物の動きを制御する仕組みを学びたいときに役立ちます。",
  "repository": "ArduPilot/ardupilot",
  "category": "developer-tools",
  "tags": ["自動操縦", "ロボティクス", "組み込み"],
  "publishedAt": "2026-09-05",
  "verifiedAt": "2026-09-05",
  "status": "published",
  "sections": [
    {"heading": "乗り物の制御を扱う", "paragraphs": ["ArduPilotは、飛行機、マルチコプター、車両、船などの自動制御を扱うソフトウェアです。", "センサーから得た姿勢や位置の情報をもとに、乗り物の動きを制御する仕組みを作れます。"]},
    {"heading": "用途に合わせた制御を試せる", "paragraphs": ["異なる種類の乗り物に向けた機能を持ち、計画した動作を試すための土台になります。", "実際の機体を作る前に、制御の考え方や設定を学び、段階的に検証できる点が利点です。"]},
    {"heading": "実機の自動運転は高い危険を伴う", "paragraphs": ["設定ミスや機器の故障、通信断は、飛行体や車両の衝突、けが、物損につながる可能性があります。", "最初はシミュレーターと無人の安全な場所で確認し、法令、保険、機体のフェイルセーフ、手動で停止する手段を満たしてから実機を動かしましょう。"]}
  ],
  "sources": [{"label": "公式リポジトリ・README", "url": "https://github.com/ArduPilot/ardupilot"}]
}
