{"schemaVersion":1,"slug":"audacity","title":"Audacity：音声を録音・編集する","summary":"Audacityは、複数の音声トラックを録音し、切り取りや加工などの編集を行うための音声エディターです。","repository":"audacity/audacity","category":"developer-tools","tags":["音声編集","録音","マルチトラック"],"publishedAt":"2026-09-05","verifiedAt":"2026-09-05","status":"published","sections":[{"heading":"これは何か","paragraphs":["録音した音声や読み込んだ音声ファイルを、複数のトラックで編集できるアプリです。"]},{"heading":"役立つ場面","paragraphs":["ポッドキャストやナレーションの不要な部分を切り取り、音量を調整したいときに役立ちます。"]},{"heading":"注意点","paragraphs":["編集を重ねる前に元の音声を別に保管します。音楽や録音の公開には著作権と出演者の許可も確認してください。"]}],"sources":[{"label":"公式リポジトリ・README","url":"https://github.com/audacity/audacity"}]}
