{"schemaVersion":1,"slug":"archivebox","title":"ArchiveBox：Webページを手元に保存する","summary":"ArchiveBoxは、URLやブラウザー履歴などからWebコンテンツを保存するためのセルフホスト型アーカイブツールです。","repository":"ArchiveBox/ArchiveBox","category":"automation","tags":["Webアーカイブ","セルフホスト","保存"],"publishedAt":"2026-09-05","verifiedAt":"2026-09-05","status":"published","sections":[{"heading":"何をするものか","paragraphs":["ArchiveBoxは、URL、ブックマーク、ブラウザー履歴などを入力にして、WebページのHTML、PDF、メディアなどを保存するためのツールです。自分で動かすWebアーカイブとして利用できます。"]},{"heading":"役立つ点","paragraphs":["後で参照したいページを、リンクだけでなく保存した形で残す助けになります。情報が変わったり消えたりする前に、どの形式で残すか考えるきっかけにもなります。"]},{"heading":"始める前の注意","paragraphs":["ページを保存できても、著作権や利用規約はそのまま適用されます。保存対象と閲覧できる人を限定し、ログインが必要なページや個人情報を含む内容の扱いを慎重に決めましょう。"]}],"sources":[{"label":"公式リポジトリ・README","url":"https://github.com/ArchiveBox/ArchiveBox"}]}
