{
  "schemaVersion": 1,
  "slug": "just",
  "title": "just：よく使う作業を短い名前で実行する",
  "summary": "justは、プロジェクトで繰り返すコマンドをまとめて実行するコマンドランナーです。作業内容をjustfileに書くと、長いコマンドを覚えずに同じ手順を共有できます。",
  "repository": "casey/just",
  "category": "automation",
  "tags": ["CLI", "タスク実行", "自動化"],
  "publishedAt": "2026-09-05",
  "verifiedAt": "2026-09-05",
  "status": "published",
  "sections": [
    {
      "heading": "決まった作業を名前で呼ぶ",
      "paragraphs": [
        "justはコマンドランナーです。プロジェクトの作業手順をjustfileに書き、名前を付けて実行します。",
        "たとえば、テスト、ビルド、開発サーバーの起動などを一つの名前にまとめられます。"
      ]
    },
    {
      "heading": "手順を共有しやすくする",
      "paragraphs": [
        "同じ作業をする人が、同じコマンドを実行しやすくなります。長いコマンドの入力ミスや、手順が人によって違う問題を減らす助けになります。",
        "READMEでは、justをコマンドランナーとして紹介しています。"
      ]
    },
    {
      "heading": "コマンドの中身は確認する",
      "paragraphs": [
        "justは書かれたコマンドを実行します。便利でも、justfileの内容が安全かどうかを自動で判断する道具ではありません。",
        "初めて使うプロジェクトでは、実行前に対象のレシピ（名前を付けた作業）と、その中で動くコマンドを読んでおきましょう。"
      ]
    }
  ],
  "sources": [
    {"label": "公式リポジトリ・README", "url": "https://github.com/casey/just"}
  ]
}
