{"schemaVersion":1,"slug":"activitywatch","title":"ActivityWatch：PCで使った時間を自動で記録する","summary":"ActivityWatchは、PC上でどのアプリやWebサイトに時間を使ったかを記録し、振り返るための時間管理ツールです。","repository":"ActivityWatch/activitywatch","category":"developer-tools","tags":["時間管理","プライバシー","デスクトップ"],"publishedAt":"2026-09-05","verifiedAt":"2026-09-05","status":"published","sections":[{"heading":"何をするものか","paragraphs":["ActivityWatchは、PCで開いていたアプリやWebサイトなどの活動時間を自動で記録するツールです。記録した内容を見て、時間の使い方を振り返れます。"]},{"heading":"役立つ点","paragraphs":["作業時間を手で入力しなくても、どの作業に時間を使ったかを把握する手がかりになります。まずは短い期間だけ記録し、どの分類で見返したいかを確認すると始めやすいです。"]},{"heading":"始める前の注意","paragraphs":["記録には利用したアプリやサイトに関する情報が含まれるため、共有PCでは特に注意が必要です。保存場所と閲覧できる人を確認し、不要な記録を残さない設定を検討しましょう。"]}],"sources":[{"label":"公式リポジトリ・README","url":"https://github.com/ActivityWatch/activitywatch"}]}
