{"schemaVersion":1,"slug":"home-assistant","title":"Home Assistant：家の機器をまとめて自動化する","summary":"Home Assistantは、家の機器やサービスを一か所で管理し、自動化するためのホームオートメーション基盤です。","repository":"home-assistant/core","category":"automation","tags":["IoT","ホームオートメーション","セルフホスト"],"publishedAt":"2026-09-05","verifiedAt":"2026-09-05","status":"published","sections":[{"heading":"何をするものか","paragraphs":["Home Assistantは、照明、センサー、家電などをつなぎ、状態の表示や自動化を行うシステムです。自宅のサーバーで動かし、機器をまとめて操作できます。"]},{"heading":"役立つ点","paragraphs":["複数の機器を一つの画面で確認し、時刻やセンサーの状態に応じた動作を作れます。最初は一つの機器の状態を表示し、通知だけの小さな自動化から試しましょう。"]},{"heading":"始める前の注意","paragraphs":["自動化の設定を誤ると、意図しない機器操作が起こることがあります。外部公開は避けてまず家庭内で試し、アカウント、更新、バックアップを確認してください。"]}],"sources":[{"label":"公式リポジトリ・README","url":"https://github.com/home-assistant/core"}]}
