{"schemaVersion":1,"slug":"k9s","title":"K9s：ターミナルでKubernetesの状態を見る","summary":"K9sは、ターミナルからKubernetesクラスタを操作・監視するためのCLIユーザーインターフェースです。","repository":"derailed/k9s","category":"developer-tools","tags":["Kubernetes","ターミナル","監視"],"publishedAt":"2026-09-05","verifiedAt":"2026-09-05","status":"published","sections":[{"heading":"これは何か","paragraphs":["Kubernetesのリソースを一覧し、ログや状態をターミナル画面で確認できるツールです。"]},{"heading":"役立つ場面","paragraphs":["kubectlの出力を何度も切り替えずに、PodやServiceなどの状態を素早く確認したいときに役立ちます。"]},{"heading":"注意点","paragraphs":["操作には現在のkubeconfigと権限が使われます。接続先のクラスタと実行できる操作を確認してから使います。"]}],"sources":[{"label":"公式リポジトリ・README","url":"https://github.com/derailed/k9s"}]}
