{"schemaVersion":1,"slug":"jenkins","title":"Jenkins：開発作業を自動化する","summary":"Jenkinsは、ビルド、テスト、静的解析、デプロイを自動化できるオープンソースのサーバーです。繰り返す開発作業を減らし、変更を早く確認したいときに役立ちます。","repository":"jenkinsci/jenkins","category":"automation","tags":["CI/CD","自動化","テスト"],"publishedAt":"2026-09-05","verifiedAt":"2026-09-05","status":"published","sections":[{"heading":"開発の流れを自動化","paragraphs":["Jenkinsは開発ワークフローを自動化するサーバーです。","変更ごとにビルドとテストを実行し、問題を早く見つけられます。"]},{"heading":"処理をつなぐ","paragraphs":["プラグインを通じて多様な自動化に対応します。","既存のツールをパイプラインにまとめられます。"]},{"heading":"小さく始める","paragraphs":["実行環境と権限を先に決めましょう。","設定とプラグインが増えると保守対象も増えます。"]}],"sources":[{"label":"公式リポジトリ・README","url":"https://github.com/jenkinsci/jenkins"}]}
