{"schemaVersion":1,"slug":"n8n","title":"n8n：サービス間の作業をつなげて自動化する","summary":"n8nは、複数のサービスやAPIをつないだ処理の流れを、画面とコードで作れるワークフロー自動化ツールです。","repository":"n8n-io/n8n","category":"automation","tags":["ワークフロー","API連携","セルフホスト"],"publishedAt":"2026-09-05","verifiedAt":"2026-09-05","status":"published","sections":[{"heading":"何をするものか","paragraphs":["n8nは、サービスから受け取った出来事をきっかけに、別のサービスで処理する流れを作るツールです。画面で部品をつなぎ、必要な箇所だけJavaScriptやPythonのコードを加えられます。"]},{"heading":"役立つ点","paragraphs":["通知、データの転記、定期処理など、手作業で繰り返している流れをまとめやすくなります。まずは入力と出力が一つずつの小さな流れを作ると、処理の順番を確認しやすくなります。"]},{"heading":"始める前の注意","paragraphs":["外部サービスの認証情報や、扱うデータの範囲を慎重に設定する必要があります。自己運用する場合は、保存データのバックアップ、更新、公開設定も管理するため、テスト用の連携から始めましょう。"]}],"sources":[{"label":"公式リポジトリ・README","url":"https://github.com/n8n-io/n8n"}]}
