{"schemaVersion":1,"slug":"wiki-js","title":"Wiki.js：Web上でチームの文書を管理する","summary":"Wiki.jsは、Webブラウザーから文書を作成・整理・共有するためのWikiアプリケーションです。","repository":"requarks/wiki","category":"developer-tools","tags":["Wiki","ドキュメント","ナレッジベース"],"publishedAt":"2026-09-05","verifiedAt":"2026-09-05","status":"published","sections":[{"heading":"何をするものか","paragraphs":["Wiki.jsは、チームの情報をWeb上のページとして作成し、整理するためのWikiアプリケーションです。文章をまとめて共有し、必要な情報を参照できる場所を作れます。"]},{"heading":"役立つ点","paragraphs":["作業手順、設計のメモ、よくある質問を一か所に集める用途に向いています。最初は一つのプロジェクトの概要と手順だけをページにし、更新の流れをチームで試してみましょう。"]},{"heading":"始める前の注意","paragraphs":["Wikiには社内情報や認証に関わる内容が集まりやすいため、閲覧・編集権限を適切に設定する必要があります。外部公開する場合は、公開対象を分け、バックアップと更新も計画しましょう。"]}],"sources":[{"label":"公式リポジトリ・README","url":"https://github.com/requarks/wiki"}]}
