{
  "schemaVersion": 1,
  "slug": "llvm-project",
  "title": "LLVM：コンパイラーを作るための部品集",
  "summary": "LLVMは、高速なコンパイラーや最適化ツール、実行環境を作るための部品を集めたプロジェクトです。CやC++向けのClangなども同じリポジトリに含まれています。",
  "repository": "llvm/llvm-project",
  "category": "developer-tools",
  "tags": ["コンパイラー", "C++", "ツールチェーン"],
  "publishedAt": "2026-09-05",
  "verifiedAt": "2026-09-05",
  "status": "published",
  "sections": [
    {
      "heading": "何をするものか",
      "paragraphs": [
        "LLVMは、コンパイラー、最適化ツール、実行環境を組み立てるためのツールキットです。中核には中間表現を処理してオブジェクトファイルへ変換するライブラリーとツールがあります。",
        "リポジトリには、CやC++などを扱うClang、リンカーのLLD、デバッガーのLLDBなど、関連する部品も含まれています。"
      ]
    },
    {
      "heading": "役立つ点",
      "paragraphs": [
        "コンパイラー全体をゼロから作らずに、再利用できる部品を土台にできます。言語を読み取る部分、最適化する部分、機械語に近い形式へ変換する部分を分けて考えられるのが利点です。",
        "既存のツールを使う場合も、Clangなどを一つのプロジェクトから入手して学べます。"
      ]
    },
    {
      "heading": "始める前の注意",
      "paragraphs": [
        "LLVMプロジェクトには多くの部品があり、目的によって必要なものが変わります。最初はLLVM本体を開発するのか、Clangを使いたいのかを決め、公式の開始ガイドで対象を絞りましょう。"
      ]
    }
  ],
  "sources": [
    {"label": "公式リポジトリ・README", "url": "https://github.com/llvm/llvm-project"}
  ]
}
